,video_id,playlist_id,title,description,upload_date
246,zq0mO36-_9w,,Can Oatmeal Reverse Heart Disease?,Less than 3% of Americans meet the daily recommended fiber intake despite research suggesting high-fiber foods such as whole ...,2015-04-27T21:09:37Z
247,2q1ln6vaSE0,,Are Melatonin Supplements Safe?,Over-the-counter melatonin (“anti-gonad hormone”) supplements tend not to contain what they say they do and the contaminants ...,2018-08-31T11:49:58Z
248,ZVR06qdg1_k,,What Is the Optimal Vitamin C Intake?,Experiments showing how much vitamin C our body absorbs and excretes can give us a sense of how many vitamin C rich fruits ...,2016-12-02T12:49:03Z
249,EVZK4n82u6w,,Is Monsanto’s Roundup Pesticide Glyphosate Safe?,Higher levels of pesticides on GMO soy is a concern since Monsanto's Roundup has been shown to be to have adverse effects on ...,2014-11-14T12:31:22Z
250,w8zoPKID_eM,,Is Carrageenan Safe?,New subscribers to our e-newsletter always receive a free gift. Get yours here: https://nutritionfacts.org/subscribe/. DESCRIPTION: ...,2013-07-31T11:20:50Z
251,7Zl0uhaL6LI,,Is Miso Healthy?,"Miso is packed with sodium, which is linked to both stomach cancer and high blood pressure, so it is safe to consume miso?",2017-02-15T12:56:28Z
252,vG44nMXpTrQ,,Back in Circulation: Sciatica and Cholesterol,"Atherosclerotic plaque clogging the arteries feeding our spine may lead to low back pain, disc degeneration, and sciatic nerve ...",2014-12-05T12:28:37Z
253,tRtX42AI9jk,,Can Cranberry Juice Treat Bladder Infections?,New subscribers to our e-newsletter always receive a free gift. Get yours here: https://nutritionfacts.org/subscribe/ DESCRIPTION: ...,2013-06-12T11:16:04Z
254,Br9AOgZAvF8,,Herbal Tea Update: Hibiscus,New subscribers to our e-newsletter always receive a free gift. Get yours here: https://nutritionfacts.org/subscribe/ DESCRIPTION: ...,2013-03-06T12:50:54Z
255,5DeTN-fci_4,,How to Treat Jet Lag with Melatonin-Rich Food,There may be a way to get the benefits of over-the-counter melatonin supplements without the risk. New subscribers to our ...,2018-09-03T11:45:28Z
256,g7z3UZy4rww,,What Are the Best Foods?,A review of reviews on the health effects of animal foods versus plant foods. New subscribers to our e-newsletter always receive a ...,2020-03-30T12:09:44Z
257,bZnvbriXGrI,,Lead in Drinking Water,"What happened in Flint Michigan, how was it discovered, and how many more Flints are there? New subscribers to our ...",2017-05-17T12:06:57Z
258,X4ubkBI_KgM,,Heavy Metal Urine Testing and Chelation for Autism,"Is testing for body burden of heavy metals like mercury with “urine mobilization tests,” “challenge tests,” “provoked urine tests” just ...",2018-04-11T12:06:27Z
259,upYpLFGjG78,,"Where Does the Arsenic in Rice, Mushrooms, and Wine Come From?",Find out what happens when our crops are grown in soil contaminated with arsenic-based pesticides and arsenic drug-laced ...,2017-07-19T12:00:27Z
260,Uyw1il99K0g,,"Heterocyclic Amines in Eggs, Cheese, and Creatine Supplements?",New subscribers to our e-newsletter always receive a free gift. Get yours here: https://nutritionfacts.org/subscribe/ DESCRIPTION: ...,2013-01-23T12:24:50Z
261,pVgzAKhz0Is,,Prunes vs. Metamucil vs. Vegan Diet,New subscribers to our e-newsletter always receive a free gift. Get yours here: https://nutritionfacts.org/subscribe/ ...,2013-03-15T11:30:44Z
262,JAqRC-kUibM,,Podcast: Obesity Series: Part 1,Today we look at a condition that is associated with a multitude of serious health issues - obesity. This episode features audio ...,2021-04-29T11:59:53Z
263,Nt8O_PuM7qc,,Are Small Intestinal Bacterial Overgrowth SIBO Tests Valid?,"Even if we could accurately diagnose SIBO, if there is no difference in symptoms between those testing positive and those testing ...",2021-08-09T11:59:50Z
264,Cv9HDEtmfwQ,,How Many Poppy Seeds Are Too Many?,New subscribers to our e-newsletter always receive a free gift. Get yours here: https://nutritionfacts.org/subscribe/ DESCRIPTION: ...,2013-10-25T11:18:27Z
265,9xg4kB3SsN8,,Does Intermittent Fasting Increase Human Life Expectancy?,Alternate-day modified fasting is put to the test for lifespan extension. New subscribers to our e-newsletter always receive a free ...,2019-11-18T13:04:09Z
266,j9OV-O5v-HA,,The Effects of Processed Meat on Lung Function,"If the nitrites in foods like ham and bacon cause lung damage, what about “uncured” meat with “no nitrites added”?",2021-03-08T12:59:46Z
267,SnqVN56EjrM,,What are the Healthiest Foods?,New subscribers to our e-newsletter always receive a free gift. Get yours here: https://nutritionfacts.org/subscribe/ DESCRIPTION: ...,2015-10-23T11:16:39Z
268,3rCg7Z3AvR0,,Fatty Meals May Impair Artery Function,We finally discovered why a single high-fat meal can cause angina chest pain. New subscribers to our e-newsletter always ...,2015-08-14T12:02:29Z
269,zPgfnwNjZ8I,,Trans Fat in Meat And Dairy,About half of America's trans fat intake now comes from animal products. New subscribers to our e-newsletter always receive a ...,2013-06-28T11:36:19Z
270,DEAcUyv4LZ4,,Flaxseed vs. Prostate Cancer,What happens when men with prostate cancer and prostatic intraepithelial neoplasia (PIN) are placed on a relatively low-fat diet ...,2013-03-25T11:33:56Z
271,AyVYK9tCF80,,The Best Source of Resveratrol,"Is there any benefit to resveratrol, and if so should we get it from wine, grapes, peanuts, or supplements? New subscribers to our ...",2018-04-02T12:01:19Z
272,EpRrD58Ah3Q,,Evidence-Based Weight Loss: Live Presentation,"In his newest live presentation from 2019, Dr. Greger offers a sneak peek into his new book How Not to Diet, which hones in on ...",2019-11-20T13:00:10Z
273,lo4kmJvoEkM,,Best Aromatherapy Herb for Alzheimers,Lemon balm may beat out drugs for controlling the symptoms of severe dementia. New subscribers to our e-newsletter always ...,2017-06-14T12:00:42Z
274,JIle6PWMmsI,,Cancer Risk from Arsenic in Rice and Seaweed,A daily half-cup of cooked rice may carry a hundred times the acceptable cancer risk of arsenic. Can seaweed from the coast of ...,2017-07-24T12:03:42Z
275,lHuoYbohf3A,,Antioxidants in a Pinch,"Some herbs and spices--including cinnamon, cloves, lemonbalm, marjoram, oregano, and peppermint--are so rich in antioxidants ...",2012-01-07T19:43:33Z
276,1AfWRfyDHw8,,Changing Our Taste Buds,New subscribers to our e-newsletter always receive a free gift. Get yours here: https://nutritionfacts.org/subscribe/ DESCRIPTION: ...,2013-09-09T11:21:25Z
277,yVjTKBw7_To,,Minimum Recommended Daily Allowance of Antioxidants,New subscribers to our e-newsletter always receive a free gift. Get yours here: https://nutritionfacts.org/subscribe/ DESCRIPTION: ...,2013-12-11T12:07:42Z
278,lIScNbcVc38,,Can Aloe Cure Cancer?,"From a case report to a randomized controlled trial, aloe is put to the test against cancer. New subscribers to our e-newsletter ...",2018-07-23T11:59:55Z
279,ypkjUy_jghQ,,Can Saunas Detoxify Lead from the Body?,How much does sweating via sauna or exercise get rid of lead and mercury? New subscribers to our e-newsletter always receive ...,2018-11-05T12:28:32Z
280,3yvYFjIlOO4,,Is Cheese Healthy? Compared to What?,Dairy is compared to other foods for cardiovascular (heart attack and stroke) risk. New subscribers to our e-newsletter always ...,2018-11-19T13:05:53Z
281,i3d1nTIGTzY,,Flaxseed vs. Diabetes,New subscribers to our e-newsletter always receive a free gift. Get yours here: https://nutritionfacts.org/subscribe/ DESCRIPTION: ...,2013-03-29T11:32:15Z
282,7MhDpQKjYE8,,Benefits of Green Tea for Boosting Antiviral Immune Function,"Unlike most antiviral drugs, green tea appears to work by boosting the immune system to combat diseases such as genital warts ...",2017-03-20T11:59:55Z
283,jG5tM2WwVjI,,Oxidized Cholesterol 27HC May Explain 3 Breast Cancer Mysteries,"Oxidized cholesterol (concentrated in products containing eggs, processed meat, and parmesan cheese) has cancer-fueling ...",2019-01-16T14:17:30Z
284,4ivLFuKLyA0,,Are Vegetarians at Risk for Eating Disorders?,"Who has the healthiest thoughts, attitudes, and habits regarding food? New subscribers to our e-newsletter always receive a free ...",2019-02-11T12:38:22Z
285,aW1Vilw0p0k,,Are Avocados Good for Your Cholesterol?,"Can guacamole lower your cholesterol as well as other whole food fat sources such as nuts, or is it just avocado industry spin.",2017-12-18T13:05:53Z
286,fEfMmaq66q0,,Fasting to Treat Depression,"A natural treatment for depression. Caloric restriction can boost levels of brain-derived neurotrophic factor (BDNF), considered to ...",2021-06-21T11:59:53Z
287,n8Ozyf8seUc,,Can Cellulite Be Treated With Diet?,New subscribers to our e-newsletter always receive a free gift. Get yours here: https://nutritionfacts.org/subscribe/. DESCRIPTION: ...,2013-04-15T11:33:03Z
288,rQa8McNAhKs,,Preventing Alzheimer’s Disease With Plants,"If foods like berries and dark green leafy vegetables have been found protective against cognitive decline, why aren't they ...",2015-01-23T12:44:03Z
289,tOnLNNS5aiM,,How to Treat Periodontitis with Diet,Plant-based diets are put to the test in the treatment of periodontal disease. New subscribers to our e-newsletter always receive a ...,2019-02-25T13:02:23Z
290,u8C5qvCwjYE,,Plant-Based Meat Substitutes Put to the Test,"Are meat substitutes healthy? What are the effects of plant-based meats on premature puberty, childhood obesity, and hip fracture ...",2021-02-08T12:59:53Z
291,byBte5p8k5Y,,Coconut Oil and the Boost in HDL “Good” Cholesterol,The effects of coconut oil are compared to butter and tallow. Even if virgin coconut oil and other saturated fats raise LDL “bad” ...,2017-08-18T12:09:38Z
292,GmAiOsZWP5E,,Boosting Brown Fat Through Diet,"The fat-burning properties of brown adipose tissue can be boosted by cold exposure, certain flavor molecules, and arginine-rich ...",2015-08-07T11:58:06Z
293,xdjtf1oXypo,,Benefits of Blueberries for the Brain,Blueberries can significantly improve cognitive performance within hours of consumption. New subscribers to our e-newsletter ...,2018-08-13T12:01:01Z
294,qAnD9XKI7J4,,Prostate Cancer and Organic Milk vs. Almond Milk,New subscribers to our e-newsletter always receive a free gift. Get yours here: https://nutritionfacts.org/subscribe/ DESCRIPTION: ...,2014-01-24T12:18:21Z
295,dwJASNFy9XQ,,Caloric Restriction vs. Animal Protein Restriction,New subscribers to our e-newsletter always receive a free gift. Get yours here: https://nutritionfacts.org/subscribe/ DESCRIPTION: ...,2014-04-07T11:11:01Z
296,-B8Fqmkbl5I,,Cayenne Pepper for IBS and Indigestion,New subscribers to our e-newsletter always receive a free gift. Get yours here: https://nutritionfacts.org/subscribe/. DESCRIPTION: ...,2013-07-26T11:24:44Z
297,4mIC_OKOjIQ,,Breast Cancer Survival Vegetable,New subscribers to our e-newsletter always receive a free gift. Get yours here: https://nutritionfacts.org/subscribe/ ...,2013-09-30T11:42:58Z
298,TFV0lRdilmw,,The Effects of Radiation Leaking from Microwave Ovens,"Simple kitchen experiments can confirm that microwaves leak from microwave ovens during operation, but do they pose a health ...",2018-01-12T13:00:01Z
299,w1yl-v7Z5I4,,Vegetarians and Stroke Risk Factors—Vitamin D?,"Could the apparent increased stroke risk in vegetarians be reverse causation? What about vegetarians versus vegans, and does ...",2020-08-10T11:59:53Z
300,tftEbb7T8AA,,The Cilantro Gene,Why are there such polarizing opinions about the taste of the fresh herb cilantro (also known as coriander leaves)?,2015-01-29T17:01:41Z
301,WGlENiyN4Dw,,What Is the Safest Metabolism Booster?,Drinking water to lose weight: Two cups of water and can result in a surge of the adrenal hormone noradrenaline in your ...,2020-10-12T11:59:50Z
302,i8UB-WNlyVE,,What Is the Ideal White Blood Cell Count?,"Since white blood cell count is such a strong predictor of lifespan, what should we aim for and how do we get it there?",2017-06-30T12:01:18Z
303,M560K-YVCds,,Which Coffee Is Healthier: Light vs. Dark Roast?,Dark roast coffee is more effective than light roast coffee in reducing body weight. New subscribers to our e-newsletter always ...,2018-12-17T12:32:25Z
304,1q9IiMHL8hs,,Do Raisins Cause Cavities?,"Dried fruit have long been thought to contribute to tooth decay, but what does the science say? New subscribers to our ...",2016-03-18T12:03:11Z
305,sHEJE6I-Yl4,,"If Fructose Is Bad, What About Fruit?",Does the fructose naturally found in fruit and fruit juice have the same adverse effects as excess “industrial fructose” (table sugar ...,2014-12-03T12:19:06Z
306,eUnJIij0sKM,,Best Food for Hay Fever (Seasonal Allergies),"A randomized, placebo-controlled, double-blind study of a 5-cents-a-day food for ragweed allergy sufferers. New subscribers to ...",2018-05-07T12:04:57Z
307,gK2E7Q-Cf4A,,Benefits of Blueberries for Blood Pressure May Be Blocked by Yogurt,Researchers try to tease out what's in dairy that interferes with the health benefits of berries and tea. New subscribers to our ...,2018-06-13T12:00:33Z
308,2e9sLsCowaE,,The Gladiator Diet How Vegetarian Athletes Stack Up,Comparing the diets of the Roman gladiator “barley men” and army troopers to the modern Spartans of today. Subscribe to Dr.,2018-12-03T12:53:27Z
309,BhZrco86qNs,,Update on Cinnamon for Blood Sugar Control,New subscribers to our e-newsletter always receive a free gift. Get yours here: https://nutritionfacts.org/subscribe/ DESCRIPTION: ...,2013-04-17T11:30:05Z
310,AvSLeoUVb54,,How to Block Breast Cancer&#39;s Estrogen-Producing Enzymes,What happens to hormone levels in women (and men) randomized to drink soymilk? New subscribers to our e-newsletter always ...,2017-04-17T12:05:42Z
311,95sT4Rdj_Xw,,Is Ginger Beneficial in a Diabetic Diet?,Ground ginger and ginger tea is put to the test for blood sugar control. New subscribers to our e-newsletter always receive a free ...,2019-02-20T13:07:06Z
312,Kpwcs-45tNM,,"NutritionFacts.org, Michael Greger, MD","http://www.NutritionFacts.org is the only non-commercial, nonprofit, science-based website to provide free daily updates on the ...",2011-06-13T16:19:34Z
313,5CeCxeJjGQY,,Does Heme Iron Cause Cancer?,"Laboratory models suggest that extreme doses of heme iron may be detrimental, but what about the effects of nutritional doses in ...",2021-02-17T12:59:53Z
314,_OQQ2Y5mVu0,,Best Brain Foods: Berries and Nuts Put to the Test,"Randomized controlled studies put nuts, berries, and grape juice to the test for cognitive function. New subscribers to our ...",2018-11-07T13:05:56Z
315,7u0jC1nQgpM,,Vegetarians and Stroke Risk Factors—Omega 3s?,Does Omega 3 fish oil have a benefit of reducing stroke risk? New subscribers to our e-newsletter always receive a free gift.,2020-08-12T11:59:49Z
316,r4bzKvN_s5k,,Ergothioneine: A New Vitamin?,New subscribers to our e-newsletter always receive a free gift. Get yours here: https://nutritionfacts.org/subscribe/ DESCRIPTION: ...,2012-11-12T11:35:17Z
317,uYiD2lhtsV4,,Angioplasty Heart Stent Risks vs. Benefits,"What do physicians and stent companies have to say for themselves, given that they are promoting expensive, risky procedures, ...",2021-03-29T11:59:48Z
318,B9WJHjsRitM,,Does an Apple a Day Really Keep the Doctor Away?,"Which would save more lives, a prescription to eat an apple a day or statin drugs? New subscribers to our e-newsletter always ...",2018-06-04T11:56:13Z
319,Ts4Y4cHclas,,Does Marijuana Cause Permanent Brain Damage in Adults?,How much cannabis is too much for those who start smoking as adults? New subscribers to our e-newsletter always receive a free ...,2018-04-18T11:58:33Z
320,bHnsawfk43Y,,Flashback Friday: How Much Fruit Is Too Much?,Does the threshold for toxicity of fructose apply to fruit or just to added industrial sugars such as sucrose and high fructose corn ...,2018-11-09T13:01:26Z
321,PsZ0qdYtQBo,,Carcinogens in Meat,Eight preparation methods to reduce exposure to carcinogens in cooked meat. New subscribers to our e-newsletter always ...,2018-07-04T11:17:59Z
322,7KcRJyXmuzo,,Dr. Greger in the Kitchen: My New Favorite Dessert (with bonus footage!),Dr. Greger whips up some matcha ice cream inspired by a recipe in his How Not to Die Cookbook - now with bonus footage!,2018-01-04T13:53:22Z
323,Y6xfwjOY_wM,,The Benefits of Millet for Diabetes,What were the remarkable results of a crossover study randomizing hundreds of people with diabetes to one and a third cup of ...,2021-03-15T11:59:54Z
324,EklWNg7yhiU,,Sodium and Autoimmune Disease: Rubbing Salt in the Wound?,"Two ways in which salt may drive autoimmune diseases such as multiple sclerosis, psoriasis, type I diabetes, Sjögren's syndrome, ...",2017-03-31T12:15:19Z
325,PDGftwDxPFA,,What Is the Optimal Diet?,The CHIP program has attempted to take the pioneering lifestyle medicine work of Pritikin and Ornish and spread it out into the ...,2018-08-01T11:31:00Z
326,KjDYAyr8K6w,,Do Vitamin B12 Supplements Cause Bone Fractures and Lung Cancer?,"The connection between B12, bone health and cancer. What do randomized controlled trials of high-dose daily vitamin B12 ...",2020-12-02T12:59:54Z
327,v7rRvZGYhWw,,Benefits of Blueberries for Artery Function,What is the optimum dose of wild blueberries to eat at a meal? New subscribers to our e-newsletter always receive a free gift.,2018-05-16T12:06:01Z
328,nmXHLkfx-qw,,The Antioxidant Effects of Acai vs. Apples,"Acai berries are touted for their antioxidant power, but does that translate into increased antioxidant capacity of your bloodstream ...",2017-07-12T12:08:26Z
329,UPZ17ztud20,,Dr. Greger in the Kitchen: My New Favorite Dessert,Dr. Greger whips up some matcha ice cream inspired by a recipe in his How Not to Die Cookbook. New subscribers to our ...,2017-12-15T13:07:04Z
330,C6udzAvvacQ,,Berries for Inflammation and Osteoarthritis Treatment,"Double-blind, randomized, placebo-controlled trials on berries and the first clinical study on the effects of berries on arthritis.",2019-06-24T11:59:51Z
331,L_bmrrevmPw,,How to Sync Your Central Circadian Clock to Your Peripheral Clocks,"Bright light exposure synchronizes the central circadian clock in our brains, whereas proper meal timing helps sync the timing of ...",2020-02-10T13:08:22Z
332,LIWZYEqWGAQ,,The Recommended Daily Added Sugar Intake,Public health authorities continue to drop the upper tolerable limit of daily added sugar intake. New subscribers to our ...,2020-03-02T12:59:49Z
333,lX6xvg1_234,,The Effects of Too Much Arsenic in the Diet,"Even at low level exposure arsenic is not just a class I carcinogen, but may impair our immune function and increase our risk of ...",2017-07-21T12:09:57Z
334,myi_Up59bvA,,Should Vegetarians Take Creatine to Normalize Homocysteine?,Creatine may normalize homocysteine levels. What are the consequences of having to make your own creatine rather than relying ...,2020-09-02T11:59:55Z
335,y0AX4K-33c8,,Strawberries versus Esophageal Cancer,New subscribers to our e-newsletter always receive a free gift. Get yours here: https://nutritionfacts.org/subscribe/ DESCRIPTION: ...,2013-05-15T11:21:20Z
336,-x8Sx5LHDxI,,Brain-Healthy Foods to Fight Aging,"What is the best source of lutein, the primary carotenoid antioxidant in the brain? Subscribe to Dr. Greger's free nutrition newsletter ...",2018-12-26T13:01:28Z
337,mwZ6Nbf7Dio,,Flashback Friday: The Best Way to Cook Sweet Potatoes,"How does sweet potato baking compare to boiling and steaming, and should we eat the skin? This video is part of our ...",2018-11-16T13:05:04Z
338,kPI8ZVD4usI,,Foods Designed to Hijack Our Appetites,Food satiety signals and weight loss. I debunk the myth of protein as the most satiating macronutrient. New subscribers to our ...,2021-07-26T11:59:51Z
339,dmcSk3sHgAw,,How to Lower Heavy Metal Levels with Diet,"What dietary change can simultaneously help detoxify mercury, lead, and cadmium from the body? New subscribers to our ...",2018-06-25T11:57:20Z
340,5wrDlfgyLF0,,Boosting Anticancer Immunity with Forest Bathing,Can forest bathing be effective as a natural cancer treatment? Visiting a forest can induce a significant increase in both the ...,2021-01-13T12:59:52Z
341,te5kLB0V1V8,,Are Melamine Dishes and Polyamide Plastic Utensils Safe?,"I recommend glass, ceramic, porcelain, or stainless-steel tableware and wooden or stainless-steel cooking utensils. Subscribe to ...",2020-05-27T11:59:52Z
342,BqkwPL0mSGw,,How Plant-Based to Lower IGF-1?,New subscribers to our e-newsletter always receive a free gift. Get yours here: https://nutritionfacts.org/subscribe/ DESCRIPTION: ...,2012-09-28T09:44:47Z
343,Cg7AANIfBl4,,The Benefits of Acai vs. Blueberries for Artery Function,"The effects on artery function of acai berries, cooked and raw blueberries, grapes, cocoa, green tea, and freshly squeezed orange ...",2017-07-14T12:00:27Z
344,nmpwQWcN3Iw,,What Not to Eat for Stroke Prevention,"What is the relationship between stroke risk and dairy, eggs, meat, and soda? New subscribers to our e-newsletter always receive ...",2020-08-03T12:03:21Z
345,NPbGbJJ1K2w,,Exploiting Sensory Specific Satiety for Weight Loss,How can we use sensory-specific satiety to our advantage? New subscribers to our e-newsletter always receive a free gift.,2021-08-02T11:59:46Z
346,D-9d1zvX9KQ,,Foods that Help Headache and Migraine Relief,Can food provide headache and migraine relief? Plant-based diets are put to the test for treating migraine headaches.,2020-03-23T11:58:57Z
347,SutgfqVEIUA,,The Reason Weight Loss Plateaus When You Diet,Understanding the metabolic and behavioral adaptations that slow weight loss New subscribers to our e-newsletter always ...,2019-10-02T11:59:59Z
348,5GMdGexw5eo,,What’s the Ideal BMI?,Is there a unisex chart to see what your optimal weight might be based on your height? How to calculate the ideal BMI. Subscribe ...,2021-01-06T12:59:50Z
349,ibnNt6BBwXM,,Is Tea Tree Oil Safe?,"The caveats for tea tree oil use, including tips on safe storage. New subscribers to our e-newsletter always receive a free gift.",2018-09-10T12:06:21Z
350,onH9lKMi5mc,,Antioxidant Rich Foods With Every Meal,New subscribers to our e-newsletter always receive a free gift. Get yours here: https://nutritionfacts.org/subscribe/ DESCRIPTION: ...,2013-12-16T12:07:44Z
351,M30cmiOomKg,,Avoiding Fish for 5 Years Before Pregnancy,The problem with fish advisories that tell pregnant women to cut down on fish is that it may be too late for certain persistent ...,2019-08-07T11:59:51Z
352,oRDD2V0J9X8,,Plant-Based Bioidentical Hormones,New subscribers to our e-newsletter always receive a free gift. Get yours here: https://nutritionfacts.org/subscribe/ DESCRIPTION: ...,2012-11-14T11:50:20Z
353,AnOm_nTupGg,,The Effects of Cell Phones and Bluetooth on Nerve Function,What impact might cell phone and Bluetooth radiation have on the inner ear? New subscribers to our e-newsletter always receive ...,2018-06-27T12:08:29Z
354,MKJmFrbuCS0,,"Turmeric Curcumin, MGUS, and Multiple Myeloma",Which plant and animal foods are associated with the development of multiple myeloma and what effect might the spice turmeric ...,2015-04-27T20:30:55Z
355,t-f9Q_-tT68,,Diabetes as a Disease of Fat Toxicity,"The “twin vicious cycles” explain how the build-up of fat in the cells of our muscles, liver, and pancreas causes type 2 diabetes, ...",2015-04-01T12:58:13Z
356,sC_-X6CBQtw,,How to Stop Tooth Decay,"If sugar consumption is considered the one and only cause of cavities, how much is too much? New subscribers to our ...",2019-07-24T12:00:00Z
357,ay72RkcGsR8,,"How to Lower Lead Levels with Diet- Thiamine, Fiber, Iron, Fat, Fasting?","Iron, zinc, oil, and even doughnuts are put to the test to see if they can block lead absorption. New subscribers to our e-newsletter ...",2017-05-26T11:55:25Z
358,7gBcK_ujNg4,,Do Lutein Supplements Help with Brain Function?,"Avocados, greens, and lutein and zeaxanthin supplements are put to the test for improving cognitive function. New subscribers to ...",2018-12-31T13:08:14Z
359,RK-0TzDbQZ8,,Flashback Friday: Will You Live Longer if You Take Vitamin D Supplements &amp; How Much Should You Take?,"For an exploration of the purported links between vitamin D and obesity, diabetes, and hypertension, see my video Do Vitamin D ...",2020-07-31T11:59:46Z
360,z1hqNPl-BWw,,Best Way to Cook Vegetables,"Boiling, steaming, microwaving, air frying, and sous vide cooking are put to the test for nutrient retention. New subscribers to our ...",2019-03-06T13:03:23Z
361,wCCuY0U1a9E,,How to Get the Weight Loss Benefits of Ephedra Without the Risks,Boosting the metabolism with ephedra: the diving reflex shows that it's possible to have selective adrenal hormone effects.,2020-10-05T12:01:50Z
362,y3KGv1J0qt4,,Tea and Artery Function,"Adding milk to tea can blocks its beneficial effects, potentially explaining why green tea drinkers appear better protected than ...",2016-03-25T11:41:27Z
363,Jr64u6Xg2gA,,Pros and Cons of a Macrobiotic Diet,"What happens when you put diabetics on a diet composed of largely whole grains, vegetables, and beans? New subscribers to ...",2018-10-10T12:04:44Z
364,x6G9knttpZc,,Best Foods for Autism,The sulforaphane found in five cents worth of broccoli sprouts is found to benefit autism in a way no drug ever has in randomized ...,2017-09-27T11:28:17Z
365,nVqiv_7qJaI,,Does Cholesterol Size Matter?,"How do American Egg Board arguments hold up to scientific scrutiny, such as the concept that large fluffy LDL cholesterol is ...",2014-10-03T11:11:59Z
366,qyqftDk-TlE,,Best Food for Lead Poisoning - Garlic,The benefits of garlic powder for treating mild-to-moderate lead poisoning. New subscribers to our e-newsletter always receive a ...,2017-06-02T12:09:24Z
367,cztrMoRjb_E,,"Optimal Vitamin B12 Dosage for Kids, Pregnancy, and Seniors","What is the optimal Vitamin B12 dosage for seniors, kids and pregnant women? At age 50, everyone, regardless of diet should ...",2020-11-02T12:59:51Z
