,video_id,playlist_id,title,description,upload_date
368,l3ilpQ-_IME,,Is It Better to Drink a Little Alcohol Than None at All?,"Even if alcohol causes cancer and there is no “French paradox,” what about the famous J-shaped curve, where yes, excessive ...",2018-04-04T11:58:41Z
369,5mB4j5Iof0c,,Is There Too Much Aluminum in Tea?,"The tea plant concentrates aluminum from the soil into tea leaves, but phytonutrients in tea bind to the metal and limit its ...",2014-10-15T11:21:57Z
370,GH1VvXgJqA4,,"Vegetarian Muscle Power, Strength, and Endurance",Randomized controlled trials put plant-based eating to the test for athletic performance. Looking for healthy holiday meals?,2018-12-11T16:32:13Z
371,5kjeaCMQ5Ys,,"Gluten-Free, Casein-Free Diets for Autism Put to the Test",The results of the first randomized controlled study of a dietary intervention for ASD (Autism Spectrum Disorder). New subscribers ...,2017-11-20T13:04:54Z
372,4aFxzAZdv7Y,,"If White Rice is Linked to Diabetes, What About China?",Protein consumption can exacerbate the insulin spike from high glycemic foods. New subscribers to our e-newsletter always ...,2015-02-17T17:23:16Z
373,aE7oBYC6Vfo,,The Benefits of Calorie Restriction for Longevity,"Though a bane for dieters, a slower metabolism may actually be a good thing. New subscribers to our e-newsletter always receive ...",2019-10-16T11:59:48Z
374,ddHUNK3CBBs,,"Is It Best to Drink Tap, Filtered, or Bottled Water?","Given the disinfection byproducts in tap water, Brita, PUR, Zerowater, and refrigerator water filters are put to the test. Subscribe to ...",2019-08-13T18:25:21Z
375,GmeIlS0cqCc,,Podcast: Fatty Liver Disease and How Not to Get It,Most people have never heard of non-alcoholic fatty liver disease but it's more common than you think. This episode features ...,2021-07-22T11:59:46Z
376,MnFJ3b0hxCU,,Do Vitamin B12 Supplements Cause Acne?,Should there be concerns around B12 and acne? Acne can be triggered in one in ten people who get vitamin B12 injections.,2020-11-30T12:59:48Z
377,r0TyxNT78Lw,,"Are Aluminum Pots, Bottles, and Foil Safe?",DNA damage is assessed in users of aluminum cookware. Subscribe to NutritionFacts.org's free newsletter to receive our B12 ...,2020-05-20T11:59:52Z
378,jaQJrNyUClw,,Type 1 Diabetes Treatment: A Plant-Based Diet,Is it possible to reverse type 1 diabetes if caught early enough? The role of diet in autoimmune diabetes. New subscribers to our ...,2020-09-28T11:59:51Z
379,B59Zk2QA1HM,,Dietary Treatments for Computer Eye Strain,New subscribers to our e-newsletter always receive a free gift. Get yours here: https://nutritionfacts.org/subscribe/ DESCRIPTION: ...,2014-01-03T12:20:49Z
380,4fq4MuxJBz0,,Cut the Calorie-Rich-And-Processed Foods,"We have an uncanny ability to pick out the subtle distinctions in calorie density of foods, but only within the natural range.",2020-04-13T11:59:48Z
381,MRBKcJTwi90,,Kombucha&#39;s Side Effects: Is It Bad for You?,What are the risks versus benefits of drinking kombucha? Can you drink too much of it? New subscribers to our e-newsletter ...,2021-04-19T11:59:52Z
382,FFBVd0dxYQI,,Fasting for Rheumatoid Arthritis,"Are there benefits of fasting as rheumatoid arthritis treatment? Fasting, followed by a plant-based diet, is put to the test for ...",2020-12-09T12:59:48Z
383,TECySdGT_jE,,How to Boost Brain BDNF Levels for Depression Treatment,"Fasting and exercise can raise BDNF levels in our brain (which plays a critical role in depression treatment), but this can also be ...",2021-06-23T11:59:48Z
384,YdH6hWFdVfU,,The Health Effects of Mycoprotein (Quorn) Products vs. BCAAs in Meat,"Clinical trials on Quorn meat substitutes show that it can improve satiety and help people control cholesterol, blood sugar, and ...",2021-02-10T12:59:52Z
385,QGRabuCog70,,Are Avocados Fattening?,"Avocado Board-funded studies suggest avocados may facilitate weight loss, but compared to what? New subscribers to our ...",2018-02-05T13:01:39Z
386,vAHaE040f9w,,The Thrifty Gene Theory  Survival of the Fattest,"Rather than being some kind of disorder or failure of willpower, weight gain - and obesity - is largely a normal response, by normal ...",2020-04-08T11:59:50Z
387,aSHv5vDi3Is,,Is Organic Meat Less Carcinogenic?,"Researchers tested 76 samples of different kinds of meat, both organic and conventional, for 33 different carcinogens.",2018-07-06T12:12:51Z
388,dpyz-AumCUk,,Is Vegan Food Always Healthy?,Healthier plant-based diets compared to unhealthy plant foods and animal foods on diabetes risk. New subscribers to our ...,2020-03-04T12:59:53Z
389,_xmZ45bXz0M,,Fruits and Vegetables Put to the Test for Boosting Mood,Mood-boosting foods: A randomized controlled trial investigates diet and psychological well-being. New subscribers to our ...,2021-08-04T11:59:47Z
390,GramY3jaEk0,,The Effect of Drinking Water on Adrenal Hormones,"Drinking water can be such a safe, simple, effective way to prevent yourself from fainting. This is due to its effect on adrenal ...",2020-10-07T11:59:51Z
391,6wjiJjZTh8U,,Benefits of Turmeric for Arsenic Exposure,See what happens when turmeric curcumin was put to the test to see if it could reverse DNA damage caused by arsenic exposure.,2017-09-20T12:05:21Z
392,NgDLZspJR5k,,Coconut Oil and Abdominal Fat,A review of the evidence on the effects of coconut oil on weight loss and belly fat. New subscribers to our e-newsletter always ...,2018-01-15T13:14:20Z
393,1v5q7z_EN14,,Testing Your Diet with Pee &amp; Purple Cabbage,New subscribers to our e-newsletter always receive a free gift. Get yours here: https://nutritionfacts.org/subscribe/ DESCRIPTION: ...,2013-10-04T11:11:10Z
394,SIr87tDhu8Q,,Stainless Steel or Cast Iron: Which Cookware Is Best? Is Teflon Safe?,What's the best type of pots and pans to use? Subscribe to NutritionFacts.org's free newsletter to receive our B12 infographic that ...,2020-05-25T11:59:55Z
395,PRifigWZ7PA,,Are Beyond Meat and the Impossible Burger Healthy?,"Beyond Meat, Impossible Burger, and your health: What happens when you compare the trans fats, saturated fat, sodium, and ...",2021-02-01T12:59:55Z
396,C_fmijwBwU4,,Clinical Studies on Acai Berries,New subscribers to our e-newsletter always receive a free gift. Get yours here: https://nutritionfacts.org/subscribe/ DESCRIPTION: ...,2013-02-27T12:37:52Z
397,l9XTjnvlIUI,,"Alkaline Diets, Animal Protein, and Calcium Loss",New subscribers to our e-newsletter always receive a free gift. Get yours here: https://nutritionfacts.org/subscribe/ DESCRIPTION: ...,2013-09-30T11:11:58Z
398,kFJVTtjxs4Y,,Benefits of Marjoram for Polycystic Ovary Syndrome (PCOS),Even a small amount of fresh herbs can double or even quadruple the antioxidant power of a meal. The ability of oregano to ...,2017-02-17T13:00:19Z
399,7KUtqevLakc,,Podcast: Controlling Diabetes,"Today, on the Nutrition Facts podcast, we look at the best diet to optimize diabetes control and prevention. This episode features ...",2021-07-29T11:59:47Z
400,wQCZfALexls,,Bean Pastas and Lentil Sprouts,"Do the benefits of beans, and lentils, and chickpeas remain when they're powdered? Also, how to use temperature stress to boost ...",2018-09-26T11:34:54Z
401,AkWd0R05ZEs,,Heart Disease Starts in Childhood,New subscribers to our e-newsletter always receive a free gift. Get yours here: https://nutritionfacts.org/subscribe/ DESCRIPTION: ...,2013-09-23T11:13:14Z
402,YtsIpX7x48k,,How Circadian Rhythms Affect Blood Sugar Levels,The same meal eaten at the wrong time of day can double blood sugars. New subscribers to our e-newsletter always receive a ...,2020-02-05T12:59:48Z
403,kRR8ouOPttE,,Time Restricted Eating Put to the Test,Are there benefits to giving yourself a bigger daily break from eating? New subscribers to our e-newsletter always receive a free ...,2019-12-04T12:59:56Z
404,P5YZlluVXn0,,Are Avocados Healthy?,"Avocado consumption can improve artery function, but what effect might guacamole have on cancer risk? New subscribers to our ...",2017-10-23T12:04:07Z
405,31MZ09HlNN8,,How to Reduce Cholesterol Oxidation,"Chicken, fish, and egg powder in processed foods present greater risk from cholesterol oxidation byproducts, but there are things ...",2018-06-01T11:42:26Z
406,LgiYwxTI0Ks,,Peppermint Oil for Irritable Bowel Syndrome,Peppermint essential oil should be considered the first-line treatment for IBS. New subscribers to our e-newsletter always receive ...,2015-07-10T11:40:03Z
407,MjoHyxGT2rE,,How to Convert Into an Equol Producer,"Certain gut bacteria can supercharge the benefits of soy foods, resulting in even more bone protection, better control of ...",2018-01-05T12:58:53Z
408,Z6IjeMtH0O0,,Are Emulsifiers Like Carboxymethylcellulose and Polysorbate 80 Safe?,Emulsifiers are the most widely used food additive. What are they doing to our gut microbiome health? New subscribers to our ...,2021-07-05T11:59:51Z
409,_2H3rg42wP8,,How to Make Your Own Fruit and Vegetable Wash,"Commercial fruit and vegetable washes fail to work better than tap water, but there is a cheap do-it-yourself solution that may ...",2015-04-29T17:37:19Z
410,3suvEOuF87c,,What the New Blood Pressure Range Guidelines Mean,Blood pressure measurement guidelines explained. Natural approaches to blood pressure control can work better than drugs ...,2020-03-11T11:59:54Z
411,guKp182Ih98,,Are Ancient Grains Healthier?,"Ancient wheats like kamut are put to the test for inflammation, blood sugar, and cholesterol control. New subscribers to our ...",2020-02-12T12:59:50Z
412,U3tY9f_AZ2s,,Lowering Our Sodium to Potassium Ratio to Reduce Stroke Risk,"That was a satisfying video to script: short and sweet, self-contained with actionable information, and a little humor thrown in.",2017-05-05T12:03:11Z
413,OIZaZq5lUew,,The Saturated Fat Studies: Buttering Up the Public,Dairy industry campaign to “neutralize the negative image of milkfat among regulators and health professionals as related to heart ...,2015-01-05T12:24:01Z
414,zEXz1HCcdNk,,Does Marijuana Cause Health Problems?,"Every year, cannabis is estimated to result in 2 million years of healthy life lost due to disability. How much is that compared to ...",2018-02-21T12:59:10Z
415,7JOp3MMOwaw,,Is Liquid Smoke Flavoring Carcinogenic?,New subscribers to our e-newsletter always receive a free gift. Get yours here: https://nutritionfacts.org/subscribe/ DESCRIPTION: ...,2014-02-26T12:11:08Z
416,dZrTzbDkJMM,,Vegetarians and Stroke Risk Factors—Saturated Fat?,How can we explain the drop in stroke risk as the Japanese diet became Westernized by eating more meat and dairy?,2020-08-19T11:59:49Z
417,h_0pEOTHt30,,Trailer for How Not to Diet: Dr. Greger’s Guide to Weight Loss,17 ingredients to an ideal weight loss diet and the 21 tweaks to accelerate the further loss of excess body fat. New subscribers to ...,2019-12-02T12:59:58Z
418,GRjtlE-JjfE,,Benzoyl Peroxide vs  Tea Tree Oil for Acne,A 5% tea tree oil gel is pitted head-to-head against the leading over-the-counter treatment for pimples. New subscribers to our ...,2018-11-02T11:59:40Z
419,Sg1D_PhJADY,,Benefits of Grapes for Brain Health,"Grape juice and whole grapes are put to the test for brain function, including cognitive decline in early Alzheimer's.",2020-02-03T12:59:49Z
420,5Hkdp3lf3II,,Flashback Friday: What Causes Insulin Resistance and Diabetes?,"Prediabetes and type 2 diabetes are caused by a drop in insulin sensitivity blamed on “intramyocellular lipid,” the buildup of fat ...",2020-02-21T12:59:49Z
421,-Nutt6LOF14,,Why Might Vegetarians Have Less HPV?,New subscribers to our e-newsletter always receive a free gift. Get yours here: https://nutritionfacts.org/subscribe/ DESCRIPTION: ...,2013-07-10T11:20:47Z
422,nEjuZsP8o7g,,Are Keto Diets Safe?,"The effects of ketogenic diets on nutrient sufficiency, gut flora, and heart disease risk. New subscribers to our e-newsletter always ...",2019-09-11T11:59:54Z
423,VfG-Ce1-lqE,,Benefits of Garlic for Fighting Cancer and the Common Cold,"Raw garlic is compared to roasted, stir-fried, simmered, and jarred garlic. New subscribers to our e-newsletter always receive a ...",2020-01-22T12:59:50Z
424,ae_bcCkRuM0,,Flashback Friday: Improving on the Mediterranean Diet &amp; Do Flexitarians Live Longer?,What are the four problematic nutritional aspects of even plant-based Mediterranean diets? Does just reducing one's intake of ...,2019-05-31T12:04:09Z
425,Vx8EWyDG0Aw,,Do Vegetarians Really Have Higher Stroke Risk?,The first study in history on the incidence of stroke of vegetarians and vegans suggests they may be at higher risk.,2020-08-05T11:59:45Z
426,oa6UtySJKFE,,Benefits and Side Effects of the Flu Vaccine,Flu shots can prevent more than just the flu. Randomized placebo-controlled trials show that they can be extraordinary lifesavers.,2024-04-08T11:59:55Z
427,s8gfRCmPB20,,Flashback Friday: How Much Should You Exercise?,"Physical fitness authorities seem to have fallen into the same trap as the nutrition authorities, recommending what they think may ...",2021-01-08T12:59:51Z
428,ZUmFfHNyj7s,,PREDIMED: Does Eating Nuts Prevent Strokes?,A randomized controlled trial found that a Mediterranean-type diet can dramatically lower the risk of subsequent heart attacks.,2015-01-29T17:21:26Z
429,Lo7-EF8tu4c,,The Efficacy and Safety of Creatine for High Homocysteine,Those on a healthy plant-based diet with elevated homocysteine levels despite taking sufficient vitamin B12 may want to consider ...,2020-09-07T11:59:48Z
430,UHv3SCUioQU,,Are There Health Benefits of Spending Time in Nature?,"Studies on green exercising, the value of greenspaces, or even just viewing trees outside the window on surgery recovery. A look ...",2020-09-21T11:59:52Z
431,Cki3FEK4et8,,Where Does the Arsenic in Chicken Come From?,What was the National Chicken Council's response to public health authorities calling for the industry to stop feeding ...,2017-07-17T12:05:43Z
432,eqCY2TOyKYo,,Fiber vs. Low FODMAP for SIBO Symptoms,"Is low FODMAP the best diet for SIBO symptoms? It may not be the number of bacteria growing in your small intestine, but the type ...",2021-08-11T11:59:46Z
433,uSiNTKkBjlQ,,What Are the Best Beverages?,"A review of the best drinks. Are there health benefits to drinking tea, coffee, milk, wine, and soda? New subscribers to our ...",2020-03-25T11:59:50Z
434,Cl6I0I8_LA0,,Is Heme Iron the Reason Meat Is Carcinogenic?,The connection between heme iron and cancer. Rectal biopsies taken before and after eating meat determine the potentially ...,2021-02-24T12:59:46Z
435,MJVSD0hggZE,,Keto Diet Theory Put to the Test,Do low carb and ketogenic diets have a metabolic advantage for weight loss? New subscribers to our e-newsletter always receive ...,2019-09-02T12:15:00Z
436,Vlr7aXD5hqI,,How to Test for Functional Vitamin B12 Deficiency,Many doctors mistakenly rely on serum B12 levels in the blood to test for vitamin B12 deficiency. New subscribers to our ...,2020-08-31T11:59:46Z
437,VXLFyZWX4AU,,"For Flavonoid Benefits, Don&#39;t Peel Apples",Peeled apples are pitted head-to-head against unpeeled apples and spinach in a test of artery function. Looking for healthy ...,2019-10-23T11:59:52Z
438,KIFIwec-yEU,,Ground Ginger to Reduce Muscle Pain,"There's been at least 8 randomized, double-blinded, placebo-controlled trials of ginger for pain. New subscribers to our ...",2018-07-27T12:09:25Z
439,fLat2Im_R84,,Best Food for Periodontal Disease and Gingivitis,What would happen if you stopped brushing your teeth but ate healthier? New subscribers to our e-newsletter always receive a ...,2018-10-08T11:53:56Z
440,bw7_vvmzBR8,,"The 3,500 Calorie per Pound Rule Is Wrong",How many fewer calories do you have to eat every day to lose one pound of body fat? New subscribers to our e-newsletter always ...,2019-09-30T11:59:56Z
441,pumVPfVuQ6s,,How to Avoid Lectin Poisoning,"How to properly cook beans. Thankfully, even the lectins that are toxic—like those found in kidney beans—are utterly destroyed by ...",2017-09-15T11:57:01Z
442,ciBSDjrSqCM,,"Podcast: You Say Nitrates, I Say Nitrites",Turns out there are good nitrates and bad nitrites. Here's the breakdown. This episode features audio from The Effects of ...,2021-08-12T11:59:51Z
443,e3hu1Tpp4AU,,Long Term Effects of Toxoplasmosis Brain Infection,The effect of toxoplasma brain parasites can cause personality alternations. New subscribers to our e-newsletter always receive a ...,2019-05-22T12:00:55Z
444,HyuXNzLzKYM,,Podcast: Boosting Our Metabolism,Today we explore the health effects of speeding up our metabolism. This episode features audio from How to Get the Weight Loss ...,2020-12-24T13:00:05Z
445,Eg7DLVYwcDs,,How to Prevent High Blood Pressure with Diet,"High blood pressure, the #1 killer risk factor in the world, may be eliminated with a healthy enough diet. New subscribers to our ...",2015-04-03T18:35:58Z
446,uptETdDvDzQ,,Does a Ketogenic Diet Help Diabetes or Make It Worse?,Keto diets put to the test for diabetes reversal. New subscribers to our e-newsletter always receive a free gift. Get yours here: ...,2019-09-18T11:59:54Z
447,lXXXygDRyBU,,"How Not To Die: The Role of Diet in Preventing, Arresting, and Reversing Our Top 15 Killers",How our food choices may influence disease prevention and treatment. In this “best-of” compilation of his last four year-in-review ...,2016-08-05T11:55:26Z
448,A4vqXj-uHxk,,Plant Based Diets Recognized by Diabetes Associations,"Plant-based diets as the single most important, yet underutilized, opportunity to reverse the pending obesity and diabetes-induced ...",2019-07-29T12:00:01Z
449,u00SQjID5E0,,Is Vitamin D3 Better Than D2?,New subscribers to our e-newsletter always receive a free gift. Get yours here: https://nutritionfacts.org/subscribe/ DESCRIPTION: ...,2013-02-13T12:19:03Z
450,jQIkaPplCxY,,Is Gluten Sensitivity Real?,"For more than 30 years, the medical profession has debated the existence of an intolerance to the wheat protein, gluten, unrelated ...",2014-08-22T10:45:22Z
451,NA7emq1WrBo,,Does Pressure Cooking Preserve Nutrients?,"How Dr. Greger pressure steams his greens. On the one hand, heat can destroy certain nutrients; on the other hand, by softening ...",2019-08-26T11:51:54Z
452,VJOg_tlh4vM,,The Worst Food for Tooth Decay,One of the worst breakfast cereals will surprise you. A dozen different foods and beverages were ranked for their “cariogenic ...,2019-03-20T11:58:02Z
453,T1FYsdC7krs,,Cell Phone Brain Tumor Risk?,What does the world's leading authority on carcinogens have to say about mobile phones? New subscribers to our e-newsletter ...,2017-10-06T11:48:16Z
454,9Nx1s6LuJNE,,Podcast: Marvelous Health Effects of Ginger,Today on the Nutrition Facts Podcast we look at what this root can do for our health. This episode features audio from Benefits of ...,2021-05-13T11:59:48Z
455,72lfQUJo10k,,Oil Pulling Benefits for Plaque and Gingivitis,Oil pulling is put to the test head-to-head against chlorhexidine mouthwash for oral and dental health measures. New subscribers ...,2017-12-08T12:52:28Z
456,4vRdOD78QKE,,Is Fasting for Weight Loss Safe?,"The reasons why fasting longer than 24 hours, and particularly three or more days, should only be done under the supervision of ...",2019-11-04T12:59:49Z
457,fRZduVxlP_U,,What Causes Insulin Resistance?,"Prediabetes and type 2 diabetes are caused by a drop in insulin sensitivity blamed on “intramyocellular lipid,” the buildup of fat ...",2015-01-29T16:48:59Z
458,s-Jcw4-xmTs,,Flashback Friday: Hibiscus Tea vs. Plant-Based Diet for Hypertension &amp; How Much Is Too Much?,"How do the blood-pressure lowering effects of hibiscus tea compare to the DASH diet, a plant-based diet, and a long-distance ...",2020-06-05T11:59:49Z
459,K6v7aa0VMOg,,Podcast: Today’s Superfood: Cabbage,Cabbage? Yes cabbage. Be sure to have one in your fridge at all times. This episode features audio from Biggest Nutrition Bang ...,2021-01-14T13:00:06Z
460,j_-rFTbiORo,,Artificial Food Colors and ADHD,New subscribers to our e-newsletter always receive a free gift. Get yours here: https://nutritionfacts.org/subscribe/ DESCRIPTION: ...,2013-08-30T11:21:11Z
461,vVOEPZqUp7Q,,Podcast: Strokes and Diet: Part 1,Strokes and how not to have one. Here's Part 1 of our 4 part series. This episode features audio from What to Eat for Stroke ...,2020-11-26T13:00:30Z
462,kXty_-3o7X8,,"The Effect of Animal Protein on Stress Hormones, Testosterone, and Pregnancy","What happened to women who were randomized to eat more meat and dairy during pregnancy, and what effect does animal ...",2017-01-18T12:56:24Z
463,hcIkhffzrkk,,Protein Intake &amp; IGF-1 Production,New subscribers to our e-newsletter always receive a free gift. Get yours here: https://nutritionfacts.org/subscribe/ DESCRIPTION: ...,2012-10-01T11:19:34Z
464,betOW0qVGLM,,Oil Pulling for Teeth Whitening and Bad Breath Tested,"When oil pulling was put to the test for teeth whitening, halitosis, and dental enamel erosion the results were no better than rinsing ...",2017-12-11T13:01:52Z
465,x3yp0oTd1YA,,"Carnitine, Choline, Cancer and Cholesterol: The TMAO Connection",New subscribers to our e-newsletter always receive a free gift. Get yours here: https://nutritionfacts.org/subscribe/ DESCRIPTION: ...,2013-04-26T11:28:55Z
466,eEojOJMoyjA,,Can You Really Remove Warts with Duct Tape?,"Duct tape beat out ten other wart treatments for not only cost but effectiveness, so why isn't it standard practice? New subscribers ...",2019-06-05T12:07:07Z
467,r3PuCQ8CxTc,,Benefits and Side Effects of the Pneumonia Vaccine,Randomized controlled trials have found that pneumonia vaccines significantly reduce the risk of pneumococcal pneumonia in ...,2024-04-10T11:59:52Z
468,mZS5nyKZyh4,,Is Sodium Lauryl Sulfate Safe?,Just because the toothpaste ingredient sodium lauryl sulfate doesn't cause cancer doesn't mean it can't cause problems.,2017-09-29T11:37:37Z
469,J5FQ_gcF3qQ,,Is Aloe Vera Gel the Best Treatment for Lichen Planus?,"We should never swallow aloe vera, but what about topical use for a chronic inflammatory autoimmune disease compared to ...",2018-05-25T11:01:23Z
470,Uq52kSYzwD8,,Does A2 Milk Carry Less Autism Risk?,The casomorphins in bovine milk appears to have opposite effects than that from human breastmilk on infant development but ...,2017-11-17T13:02:47Z
471,pI4OYCOhCYA,,Lose Two Pounds in One Sitting: Taking the Mioscenic Route,Our physiology evolved for millions of years eating a plant-based diet. What would happen if researchers tried to recreate our ...,2016-06-03T10:56:48Z
472,VeOT7DYJIZ8,,Ginger for Migraines,An eighth teaspoon of powdered ginger found to work as well as the migraine headache drug sumatriptan (Imitrex) without the ...,2015-06-10T11:56:36Z
473,nE16SMsoXSE,,"COVID-19 Symptoms vs. the Flu, a Cold, or Allergies",What does clinical course of COVID-19 look like for both those who survive and those who don't? How the symptoms compare to ...,2020-06-22T11:59:48Z
474,AWkYHbP8sb0,,"Eczema Treatment with Coconut Oil, Mineral Oil, vs. Vaseline","Natural topical remedies for eczema are put to the test, including licorice root gel, St. John's Wort cream, and emollients such as ...",2017-10-16T11:55:58Z
475,pxgxXMwSomA,,How to Become a Fecal Transplant Super Donor,What's more important: probiotics or prebiotics? And where best to get them? New subscribers to our e-newsletter always receive ...,2017-03-24T12:02:44Z
476,mEbcM_5Iz8Q,,Natural Treatments for Morning Sickness,Can cannabis and ginger be considered safe and effective treatments for hyperemesis gravidarum (severe morning sickness ...,2016-06-06T11:20:53Z
477,pEQ8orjYNPA,,"Is It the Diet, the Exercise, or Both?",New subscribers to our e-newsletter always receive a free gift. Get yours here: https://nutritionfacts.org/subscribe/ DESCRIPTION: ...,2012-09-19T11:23:50Z
478,KKcIPUIvxRM,,Recipe: Easy Veggie Tacos,"This vegan and vegetarian taco recipe ""Veggie Tacos"" comes from staff member Ángela at NutritionFacts. Looking for healthy ...",2019-07-17T11:57:22Z
479,71E7liHAJ2M,,How to Prevent Toxoplasmosis,The risk of contracting the brain parasite toxoplasma from kitty litter vs. meat. New subscribers to our e-newsletter always receive a ...,2019-05-29T12:03:29Z
480,ho4sNQPBXMc,,Chronobiology - How Circadian Rhythms Can Control Your Health and Weight,Given the power of chronotherapy—how the same dose of the same drugs taken at a different time of day can have such different ...,2020-01-15T13:00:04Z
481,GP5OiTAUkkU,,Are There Benefits of Pole Walking for Weight Loss?,"Does walking with poles, also known as Nordic walking (“exerstriding”), beat our regular walking for depression, sleep quality, ...",2020-11-23T12:59:50Z
482,uksaJeHfmsA,,Best Food to Counter the Effects of Air Pollution,"There is a food that offers the best of both worlds, significantly improving our ability to detox carcinogens like diesel fumes and ...",2017-04-24T11:57:59Z
483,tx9s9pb00wI,,Is Weight Loss on Ketosis Sustainable?,Might the appetite-suppressing effects of ketosis improve dietary compliance? New subscribers to our e-newsletter always receive ...,2019-09-09T12:00:12Z
484,w8g4QaZZEzs,,The Role of Pesticides and Pollution in Autism,"The effects of smoking, pesticides, vaccine mercury, and air pollution on autistic spectrum disorder risk. New subscribers to our ...",2018-01-29T12:59:41Z
485,Fzs9qmAc4xY,,What’s the Ideal Waist Size?,Are there benefits to reducing waist size? Increased risk of metabolic complications starts at an abdominal circumference of 31.5 ...,2021-01-11T12:59:47Z
486,sCp9ZLmm9Lo,,Best Food to Counter Stress-Induced Immune Suppression,"How to improve immune function in children, and adults under physical or psychological stress. New subscribers to our ...",2018-01-08T12:57:34Z
487,tiJQMzwQRis,,Does Sugar Lead to Weight Gain?,The sugar industry's response to evidence implicating sweeteners in the obesity epidemic. New subscribers to our e-newsletter ...,2019-10-14T11:59:51Z
